{
  "schema": "staxtrace.anchor/1",
  "command": "get",
  "db": "/campaign/.stax-anchors.db",
  "generated": "2026-07-31T04:00:00.000Z",
  "query": {
    "key": null
  },
  "anchors": [
    {
      "key": "architect-state",
      "ts": "2026-07-31T03:04:00.000Z",
      "session_hint": null,
      "body": "# Architect state\n\n- wave 0: GATED (69fb328)\n- wave 1: anchor storage, `anchor set|get|log`, goldens\n- next: wave 2 adapters\n"
    },
    {
      "key": "unicode-note",
      "ts": "2026-07-31T03:03:00.000Z",
      "session_hint": null,
      "body": "π ≈ 3.14159 — ünïcode ✓ 日本語 «quoted» \"escaped\"\tand\\backslashed"
    },
    {
      "key": "wave-state",
      "ts": "2026-07-31T03:01:00.000Z",
      "session_hint": "019849e2-7c4f-7a51-9f2b-6b1d0c3ea4d7",
      "body": "wave 1 fanning out: A envelopes, B memory verbs, C anchor"
    }
  ],
  "anchor_count": 3
}
